{
  "profileVersion": "1.0",
  "adapterLanguage": "typescript",
  "providerId": "conformance-typescript",
  "generatedAt": "2026-07-17T15:45:55.166Z",
  "status": "passed",
  "scopes": {
    "runtimeProfile": {
      "status": "partial",
      "basis": "P0-P4 clauses exercised here plus the repository T-001..T-047 matrix; resource-specific qualification remains external."
    },
    "adapterProtocol": {
      "status": "passed",
      "basis": "Manifest, identity, command sequencing, response loss, retry/reject, output, input and restart scenarios."
    },
    "resourceSpecificSafety": {
      "status": "not_claimed",
      "basis": "Reference Mock Adapters have no real external resource safety qualification."
    }
  },
  "groups": [
    {
      "id": "P0",
      "status": "passed",
      "tests": [
        {
          "name": "P0 protocol/catalog and synchronous Tool",
          "status": "passed",
          "durationMs": 146.61789999999996
        },
        {
          "name": "P0 persisted task_required lifecycle and terminal read",
          "status": "passed",
          "durationMs": 97.34940000000006
        }
      ]
    },
    {
      "id": "P1",
      "status": "passed",
      "tests": [
        {
          "name": "P1 checkAvailability four states, risk and windows",
          "status": "passed",
          "durationMs": 7.501800000000003
        }
      ]
    },
    {
      "id": "P2",
      "status": "passed",
      "tests": [
        {
          "name": "P2 scheduled start is durable and never early",
          "status": "passed",
          "durationMs": 85.39370000000008
        },
        {
          "name": "P2 retryable start rejection has a bounded retry identity",
          "status": "passed",
          "durationMs": 5.846199999999953
        }
      ]
    },
    {
      "id": "P3",
      "status": "passed",
      "tests": [
        {
          "name": "P3 restricted arbitration accepts or rejects without ambiguity",
          "status": "passed",
          "durationMs": 22.96620000000007
        },
        {
          "name": "P3 pause/resume acknowledgements preserve a working execution",
          "status": "passed",
          "durationMs": 27.360400000000027
        }
      ]
    },
    {
      "id": "P4",
      "status": "passed",
      "tests": [
        {
          "name": "P4 input_required and multi-round update",
          "status": "passed",
          "durationMs": 225.78150000000005
        },
        {
          "name": "P4 cancel Ack, safe stop proof and duplicate idempotency",
          "status": "passed",
          "durationMs": 101.03539999999998
        },
        {
          "name": "P4 invocation idempotency duplicate and conflict",
          "status": "passed",
          "durationMs": 24.760300000000143
        },
        {
          "name": "P4 response-loss Reconcile without duplicate identity",
          "status": "passed",
          "durationMs": 26.328399999999874
        },
        {
          "name": "P4 Adapter task/argument identity conflict",
          "status": "passed",
          "durationMs": 11.02579999999989
        },
        {
          "name": "P4 Adapter output mismatch becomes a failed Task",
          "status": "passed",
          "durationMs": 37.375499999999874
        },
        {
          "name": "P4 command sequence mismatch is observable",
          "status": "passed",
          "durationMs": 11.836399999999912
        },
        {
          "name": "P4 safe-stop permanent, retryable and transport rejection",
          "status": "passed",
          "durationMs": 63.98180000000002
        },
        {
          "name": "P4 Adapter process restart retains execution binding",
          "status": "passed",
          "durationMs": 0.16190000000005966
        },
        {
          "name": "P4 terminal irreversibility and observation/outbox idempotency",
          "status": "passed",
          "durationMs": 50.717899999999645
        }
      ]
    }
  ]
}
